<!ELEMENT students (student+)>
<!ELEMENT student (SID,SName,Age,Address,DOB)>
<!ELEMENT SID (#PCDATA)>
<!ELEMENT SName (#PCDATA)>
<!ELEMENT Age (#PCDATA)>
<!ELEMENT Address (#PCDATA)>
<!ELEMENT DOB (#PCDATA)>
